### ISSUE TITLE
Network.Connection.connectionGetChunk: end of file

### ISSUE THREAD

**Issue by leonbaum** [tfausak/wuss#1]
I'm streaming data over what should be a fairly solid network, but every 30 minutes or so I'm getting an EOF exception.  Is it possible that this is a bug or is it really just a network problem?

**Comment by tfausak** [comment]
I have not seen this error even though I have kept a secure WebSocket open for several hours. Do you see the same error if you keep a connection to an insecure WebSocket open?

**Comment by tfausak** [comment]
Assuming that `echo.websocket.org` is reliable, you could let this code run for a while:

``` hs
module Issue1 where

import Control.Concurrent (forkIO, threadDelay)
import Control.Monad (forever, void)
import Data.Time.Clock (getCurrentTime)
import Data.Text (pack)
import Network.WebSockets (ClientApp, receiveDataMessage, sendTextData)
import Wuss (runSecureClient)

main :: IO ()
main = runSecureClient "echo.websocket.org" 443 "/" client

client :: ClientApp ()
client connection = do
    void . forkIO . forever $ do
        message <- receiveDataMessage connection
        print message

    forever $ do
        now <- getCurrentTime
        sendTextData connection (pack (show now))
        void $ threadDelay 1000000
```

**Comment by leonbaum** [comment]
Thanks for the suggestion.  After further investigation, I think it may be a problem with the 3rd party server.  It seems to be closing the connection:
```
238091 2725.559210 server_ip -> client_ip TLSv1.2 331 Application Data
238092 2725.559353 client_ip -> server_ip TCP 54 57965 > 443 [ACK] Seq=1 Ack=33454470 Win=4161 Len=0
238093 2725.575009 server_ip -> client_ip TLSv1.2 331 Application Data
238094 2725.575215 client_ip -> server_ip TCP 54 57965 > 443 [ACK] Seq=1 Ack=33454747 Win=4161 Len=0
238095 2725.588493 server_ip -> client_ip TLSv1.2 379 Application Data
238096 2725.588612 client_ip -> server_ip TCP 54 57965 > 443 [ACK] Seq=1 Ack=33455072 Win=4161 Len=0
238097 2725.597025 server_ip -> client_ip TLSv1.2 331 Application Data
238098 2725.597167 client_ip -> server_ip TCP 54 57965 > 443 [ACK] Seq=1 Ack=33455349 Win=4161 Len=0
238117 2730.747336 server_ip -> client_ip TCP 60 443 > 57965 [FIN, ACK] Seq=33455349 Ack=1 Win=31 Len=0
238118 2730.786022 client_ip -> server_ip TCP 54 57965 > 443 [ACK] Seq=1 Ack=33455350 Win=4161 Len=0
238119 2731.074485 client_ip -> server_ip TCP 54 57965 > 443 [FIN, ACK] Seq=1 Ack=33455350 Win=4161 Len=0
238120 2731.075733 server_ip -> client_ip TCP 60 443 > 57965 [ACK] Seq=33455350 Ack=2 Win=31 Len=0
```

**Comment by tfausak** [comment]
Although I have not done it, I think you could use [`receive`](http://hackage.haskell.org/package/websockets-0.9.3.1/docs/Network-WebSockets.html#v:receive) to handle the close messages and reopen the connection.

**Comment by dimitri-xyz** [comment]
I'm seeing something similar to this on a secure socket from the GDAX data stream (wss://ws-feed.gdax.com). I get the same error about once every 6 hours. The connection is to a 24x7 market data feed. It's possible GDAX servers also reset the connection, but that's not what they tell me. So, I'm also wondering if this could be an issue.

**Comment by leonbaum** [comment]
@dimitri-xyz 

I'm no longer using Haskell for my Bitcoin market data feeds, but I too frequently lose connection to the Coinbase/GDAX websocket feed.  Their servers are clearly periodically dropping connections.  I just wait a few seconds and then reconnect.  The connection to their FIX server for order management seems to be more stable, however.

**Comment by dimitri-xyz** [comment]
@leonbaum Got it. Thanks!
